<?xml version="1.0" encoding="utf-8"?>
<feed xmlns="http://www.w3.org/2005/Atom">
    <title>Хранилище заметок</title>
    <link href="https://lukyanovartem.github.io/atom.xml" rel="self" />
    <link href="https://lukyanovartem.github.io" />
    <id>https://lukyanovartem.github.io/atom.xml</id>
    <author>
        <name>Artem Lukyanov</name>
        
    </author>
    <updated>2026-01-08T00:00:00Z</updated>
    <entry>
    <title>NetBSD на Raspberry Pi 3</title>
    <link href="https://lukyanovartem.github.io/posts/netbsd.html" />
    <id>https://lukyanovartem.github.io/posts/netbsd.html</id>
    <published>08.01.2026</published>
    <updated>2026-01-08T00:00:00Z</updated>
    <summary type="html"><![CDATA[<p>
<div class="title"><h1><a href="/posts/netbsd.html">NetBSD на Raspberry Pi 3</a></h1></div>
<div class="meta"> 8 января 2026</div>

</p>
<p>Создание пользователя</p>
<div class="sourceCode" id="cb1"><pre class="sourceCode sh"><code class="sourceCode bash"><span id="cb1-1"><a href="#cb1-1" aria-hidden="true" tabindex="-1"></a><span class="ex">useradd</span> <span class="at">-m</span> <span class="at">-G</span> wheel Artem</span></code></pre></div>
<p>Редактирование /etc/passwd</p>
<div class="sourceCode" id="cb2"><pre class="sourceCode sh"><code class="sourceCode bash"><span id="cb2-1"><a href="#cb2-1" aria-hidden="true" tabindex="-1"></a><span class="ex">vipw</span></span></code></pre></div>
<p>Настройка времени</p>
<div class="sourceCode" id="cb3"><pre class="sourceCode sh"><code class="sourceCode bash"><span id="cb3-1"><a href="#cb3-1" aria-hidden="true" tabindex="-1"></a><span class="fu">ln</span> <span class="at">-fs</span> /usr/share/zoneinfo/Europe/Moscow /etc/localtime</span></code></pre></div>
<p>Настройка разрешения экрана<br />
/boot/config.txt</p>
<div class="sourceCode" id="cb4"><pre class="sourceCode default"><code class="sourceCode default"><span id="cb4-1"><a href="#cb4-1" aria-hidden="true" tabindex="-1"></a># последняя единица чтобы убрать рамки</span>
<span id="cb4-2"><a href="#cb4-2" aria-hidden="true" tabindex="-1"></a>hdmi_cvt=1920 1080 60 3 0 0 1</span>
<span id="cb4-3"><a href="#cb4-3" aria-hidden="true" tabindex="-1"></a># игнорировать разрешение монитора</span>
<span id="cb4-4"><a href="#cb4-4" aria-hidden="true" tabindex="-1"></a>hdmi_ignore_edid=0xa5000080</span>
<span id="cb4-5"><a href="#cb4-5" aria-hidden="true" tabindex="-1"></a>hdmi_group=2</span>
<span id="cb4-6"><a href="#cb4-6" aria-hidden="true" tabindex="-1"></a>hdmi_mode=87</span>
<span id="cb4-7"><a href="#cb4-7" aria-hidden="true" tabindex="-1"></a># игнорировать отсутствие монитора</span>
<span id="cb4-8"><a href="#cb4-8" aria-hidden="true" tabindex="-1"></a>hdmi_force_hotplug=1</span></code></pre></div>
<p>Имя хоста<br />
/etc/dhcpcd.conf</p>
<div class="sourceCode" id="cb5"><pre class="sourceCode default"><code class="sourceCode default"><span id="cb5-1"><a href="#cb5-1" aria-hidden="true" tabindex="-1"></a>hostname</span></code></pre></div>
<p>/etc/rc.conf</p>
<div class="sourceCode" id="cb6"><pre class="sourceCode default"><code class="sourceCode default"><span id="cb6-1"><a href="#cb6-1" aria-hidden="true" tabindex="-1"></a>hostname=rpi3</span></code></pre></div>
<p>Настройка XDM<br />
/etc/rc.conf</p>
<div class="sourceCode" id="cb7"><pre class="sourceCode default"><code class="sourceCode default"><span id="cb7-1"><a href="#cb7-1" aria-hidden="true" tabindex="-1"></a>xdm=YES</span></code></pre></div>
<p>Разрешаем локальный беспарольный вход<br />
/etc/X11/xdm/Xresources</p>
<div class="sourceCode" id="cb8"><pre class="sourceCode default"><code class="sourceCode default"><span id="cb8-1"><a href="#cb8-1" aria-hidden="true" tabindex="-1"></a>xlogin*allowNullPasswd: true</span></code></pre></div>
<p>/etc/pam.d/display_manager</p>
<div class="sourceCode" id="cb9"><pre class="sourceCode default"><code class="sourceCode default"><span id="cb9-1"><a href="#cb9-1" aria-hidden="true" tabindex="-1"></a>auth            required        pam_unix.so             no_warn try_first_pass nullok</span></code></pre></div>
<p>Русская раскладка<br />
/etc/X11/xdm/Xsession</p>
<div class="sourceCode" id="cb10"><pre class="sourceCode sh"><code class="sourceCode bash"><span id="cb10-1"><a href="#cb10-1" aria-hidden="true" tabindex="-1"></a>        <span class="ex">...</span></span>
<span id="cb10-2"><a href="#cb10-2" aria-hidden="true" tabindex="-1"></a>        <span class="co"># xrandr из-за ошибки BadRROutput</span></span>
<span id="cb10-3"><a href="#cb10-3" aria-hidden="true" tabindex="-1"></a>        <span class="ex">xrandr</span> <span class="kw">&amp;&amp;</span> <span class="ex">setxkbmap</span> <span class="at">-layout</span> <span class="st">&#39;us,ru&#39;</span> <span class="at">-option</span> <span class="st">&#39;grp:caps_toggle,grp_led:caps&#39;</span></span>
<span id="cb10-4"><a href="#cb10-4" aria-hidden="true" tabindex="-1"></a>        <span class="bu">exec</span> /usr/X11R7/bin/ctwm <span class="at">-W</span></span></code></pre></div>
<p>~/.profile</p>
<div class="sourceCode" id="cb11"><pre class="sourceCode sh"><code class="sourceCode bash"><span id="cb11-1"><a href="#cb11-1" aria-hidden="true" tabindex="-1"></a><span class="bu">export</span> <span class="va">LANG</span><span class="op">=</span><span class="st">&quot;ru_RU.UTF-8&quot;</span></span>
<span id="cb11-2"><a href="#cb11-2" aria-hidden="true" tabindex="-1"></a><span class="bu">export</span> <span class="va">PKG_PATH</span><span class="op">=</span><span class="st">&quot;https://mirror.yandex.ru/pub/pkgsrc/packages/NetBSD/</span><span class="va">$</span><span class="st">(uname -p)/</span><span class="va">$</span><span class="st">(uname -r|cut -f &#39;1 2&#39; -d.|cut -f 1 -d_)/All&quot;</span></span></code></pre></div>
<p>Исправление ошибки “No entry for terminal type” при удалённом входе. На других машинах<br />
~/.ssh/config</p>
<div class="sourceCode" id="cb12"><pre class="sourceCode default"><code class="sourceCode default"><span id="cb12-1"><a href="#cb12-1" aria-hidden="true" tabindex="-1"></a>host rpi3</span>
<span id="cb12-2"><a href="#cb12-2" aria-hidden="true" tabindex="-1"></a>   SetEnv TERM=xterm</span></code></pre></div>
<p>Монтирование сетевой файловой системы sshfs<br />
/etc/fstab</p>
<div class="sourceCode" id="cb13"><pre class="sourceCode default"><code class="sourceCode default"><span id="cb13-1"><a href="#cb13-1" aria-hidden="true" tabindex="-1"></a>ssh@server:/data /mnt psshfs ro,noauto,-O=BatchMode=yes,-O=IdentityFile=/home/Artem/.ssh/id_ed25519,-t=-1</span></code></pre></div>
<p>Запрещаем удалённый вход по паролю<br />
/etc/ssh/sshd_config</p>
<div class="sourceCode" id="cb14"><pre class="sourceCode default"><code class="sourceCode default"><span id="cb14-1"><a href="#cb14-1" aria-hidden="true" tabindex="-1"></a>PasswordAuthentication no</span>
<span id="cb14-2"><a href="#cb14-2" aria-hidden="true" tabindex="-1"></a>UsePAM no</span></code></pre></div>
<p>
    <div class="meta">
    
      категории <a title="All pages tagged &#39;netbsd&#39;." href="/tags/netbsd.html" rel="tag">netbsd</a>
    
    </div>
    <span class="disqus-comment-count" data-disqus-identifier="posts/netbsd.md"></span>
</p>
]]></summary>
</entry>
<entry>
    <title>Шпаргалка по NixOS</title>
    <link href="https://lukyanovartem.github.io/posts/nixos.html" />
    <id>https://lukyanovartem.github.io/posts/nixos.html</id>
    <published>07.05.2025</published>
    <updated>2025-05-07T00:00:00Z</updated>
    <summary type="html"><![CDATA[<p>
<div class="title"><h1><a href="/posts/nixos.html">Шпаргалка по NixOS</a></h1></div>
<div class="meta"> 7 мая 2025</div>

</p>
<p>Работа офлайн<br />
<a href="https://github.com/lukyanovartem/scripts/tree/master/moonix">Скрипт</a> скачивает все зависимости для сборки пакетов с открытым исходным кодом</p>
<div class="sourceCode" id="cb1"><pre class="sourceCode sh"><code class="sourceCode bash"><span id="cb1-1"><a href="#cb1-1" aria-hidden="true" tabindex="-1"></a><span class="ex">nix</span> build .#<span class="op">&lt;</span>пакет<span class="op">&gt;</span> --offline</span></code></pre></div>
<p>Деплой</p>
<div class="sourceCode" id="cb2"><pre class="sourceCode sh"><code class="sourceCode bash"><span id="cb2-1"><a href="#cb2-1" aria-hidden="true" tabindex="-1"></a><span class="ex">nixos-rebuild</span> switch <span class="at">--target-host</span> <span class="op">&lt;</span>адрес машины<span class="op">&gt;</span> --sudo</span></code></pre></div>
<p>Работа с nix store</p>
<div class="sourceCode" id="cb3"><pre class="sourceCode sh"><code class="sourceCode bash"><span id="cb3-1"><a href="#cb3-1" aria-hidden="true" tabindex="-1"></a><span class="fu">sudo</span> nix-collect-garbage <span class="at">-d</span></span>
<span id="cb3-2"><a href="#cb3-2" aria-hidden="true" tabindex="-1"></a><span class="fu">sudo</span> nix-store <span class="at">--optimise</span></span>
<span id="cb3-3"><a href="#cb3-3" aria-hidden="true" tabindex="-1"></a><span class="fu">sudo</span> nix-store <span class="at">--verify</span> <span class="at">--check-contents</span> <span class="at">--repair</span></span></code></pre></div>
<p>Обновление flakes</p>
<div class="sourceCode" id="cb4"><pre class="sourceCode sh"><code class="sourceCode bash"><span id="cb4-1"><a href="#cb4-1" aria-hidden="true" tabindex="-1"></a><span class="ex">nix</span> flake update <span class="op">&lt;</span>flake<span class="op">&gt;</span> --flake <span class="op">&lt;</span>путь до конфигурации nixos<span class="op">&gt;</span></span></code></pre></div>
<p>Использование системного nixpkgs в flakes репозитории</p>
<div class="sourceCode" id="cb5"><pre class="sourceCode sh"><code class="sourceCode bash"><span id="cb5-1"><a href="#cb5-1" aria-hidden="true" tabindex="-1"></a><span class="ex">nix</span> flake lock <span class="at">--override-input</span> nixpkgs flake:nixpkgs</span></code></pre></div>
<p>nix-output-monitor</p>
<div class="sourceCode" id="cb6"><pre class="sourceCode sh"><code class="sourceCode bash"><span id="cb6-1"><a href="#cb6-1" aria-hidden="true" tabindex="-1"></a><span class="op">&lt;</span>команда<span class="op">&gt;</span> --log-format <span class="ex">internal-json</span> <span class="at">-v</span> <span class="kw">|&amp;</span> <span class="ex">nom</span> <span class="at">--json</span></span></code></pre></div>
<p>Тестирование конфигурации</p>
<div class="sourceCode" id="cb7"><pre class="sourceCode sh"><code class="sourceCode bash"><span id="cb7-1"><a href="#cb7-1" aria-hidden="true" tabindex="-1"></a><span class="fu">sudo</span> nixos-rebuild test</span></code></pre></div>
<p>Путь до исходников в установленной системе</p>
<div class="sourceCode" id="cb8"><pre class="sourceCode sh"><code class="sourceCode bash"><span id="cb8-1"><a href="#cb8-1" aria-hidden="true" tabindex="-1"></a><span class="ex">nix</span> flake metadata nixpkgs</span></code></pre></div>
<p>Использование локальной инфраструктуры для сборки</p>
<div class="sourceCode" id="cb9"><pre class="sourceCode sh"><code class="sourceCode bash"><span id="cb9-1"><a href="#cb9-1" aria-hidden="true" tabindex="-1"></a><span class="ex">nix</span> build .#<span class="op">&lt;</span>имя пакета<span class="op">&gt;</span> --builders <span class="st">&#39;ssh-ng://&lt;адрес машины&gt;&#39;</span> <span class="at">--option</span> builders-use-substitutes true <span class="at">-j0</span></span></code></pre></div>
<p>
    <div class="meta">
    
      категории <a title="All pages tagged &#39;nixos&#39;." href="/tags/nixos.html" rel="tag">nixos</a>
    
    </div>
    <span class="disqus-comment-count" data-disqus-identifier="posts/nixos.md"></span>
</p>
]]></summary>
</entry>
<entry>
    <title>Запуск Stable Diffusion на слабом железе</title>
    <link href="https://lukyanovartem.github.io/posts/sd.html" />
    <id>https://lukyanovartem.github.io/posts/sd.html</id>
    <published>25.04.2025</published>
    <updated>2025-04-25T00:00:00Z</updated>
    <summary type="html"><![CDATA[<p>
<div class="title"><h1><a href="/posts/sd.html">Запуск Stable Diffusion на слабом железе</a></h1></div>
<div class="meta">25 апреля 2025</div>

</p>
<p>Удалось запустить Stable Diffusion на слабой машине с интегрированной карточкой Intel UHD Graphics 620.<br />
Для запуска использовал софт <a href="https://github.com/leejet/stable-diffusion.cpp" class="uri">https://github.com/leejet/stable-diffusion.cpp</a> (нужно собирать с поддержкой Vulkan).<br />
И модель <a href="https://huggingface.co/stabilityai/sdxl-turbo/blob/main/sd_xl_turbo_1.0_fp16.safetensors" class="uri">https://huggingface.co/stabilityai/sdxl-turbo/blob/main/sd_xl_turbo_1.0_fp16.safetensors</a><br />
Параметры для запуска описаны в <a href="https://huggingface.co/stabilityai/sdxl-turbo">README</a> модели. Единственное отличие в том, что вместо <code>guidance_scale=0.0</code> нужно использовать <code>cfg-scale 1</code>.<br />
Другая моделька <a href="https://huggingface.co/RunDiffusion/Juggernaut-X-Hyper/blob/main/JuggernautXRundiffusion_Hyper.safetensors" class="uri">https://huggingface.co/RunDiffusion/Juggernaut-X-Hyper/blob/main/JuggernautXRundiffusion_Hyper.safetensors</a><br />
Для борбы с нехваткой памяти следует использовать TAESD <a href="https://huggingface.co/madebyollin/taesdxl/blob/main/diffusion_pytorch_model.safetensors" class="uri">https://huggingface.co/madebyollin/taesdxl/blob/main/diffusion_pytorch_model.safetensors</a> и параметр <code>clip-on-cpu</code>.<br />
Поскольку изображение получается размера 512x512, можно использовать апскейлер <a href="https://civitai.com/models/147821/realesrganx4plus-anime-6b" class="uri">https://civitai.com/models/147821/realesrganx4plus-anime-6b</a> или <a href="https://civitai.com/models/147817/realesrganx4plus" class="uri">https://civitai.com/models/147817/realesrganx4plus</a> для увеличения разрешения в 4 раза.</p>
<p>
    <div class="meta">
    
      категории <a title="All pages tagged &#39;stable diffusion&#39;." href="/tags/stable%20diffusion.html" rel="tag">stable diffusion</a>
    
    </div>
    <span class="disqus-comment-count" data-disqus-identifier="posts/sd.md"></span>
</p>
]]></summary>
</entry>
<entry>
    <title>Настройки YouTube ReVanced</title>
    <link href="https://lukyanovartem.github.io/posts/revanced.html" />
    <id>https://lukyanovartem.github.io/posts/revanced.html</id>
    <published>11.04.2025</published>
    <updated>2025-04-11T00:00:00Z</updated>
    <summary type="html"><![CDATA[<p>
<div class="title"><h1><a href="/posts/revanced.html">Настройки YouTube ReVanced</a></h1></div>
<div class="meta">11 апреля 2025</div>

</p>
<h1 id="настройки">Настройки</h1>
<h2 id="revanced">ReVanced</h2>
<h3 id="плеер">Плеер</h3>
<ul class="task-list">
<li><label><input type="checkbox" checked="" />Скрыть предлагаемые видео в конце просмотра</label></li>
</ul>
<h4 id="миниплеер">Миниплеер</h4>
<ul>
<li>Тип миниплеера
<ul class="task-list">
<li><label><input type="checkbox" checked="" />Минимальный</label></li>
</ul></li>
</ul>
<h3 id="shorts">Shorts</h3>
<ul class="task-list">
<li><label><input type="checkbox" checked="" />Скрыть Shorts в ленте “Главной”</label></li>
<li><label><input type="checkbox" checked="" />Скрыть Shorts в результатах поиска</label></li>
</ul>
<h3 id="sponsorblock">SponsorBlock</h3>
<ul class="task-list">
<li><label><input type="checkbox" checked="" />Кнопка создания сегмента</label></li>
</ul>
<h2 id="общие">Общие</h2>
<ul>
<li><label><input type="checkbox" />Напоминать делать перерывы</label></li>
<li><label><input type="checkbox" />Напоминать, что пора спать</label></li>
<li>Тема
<ul class="task-list">
<li><label><input type="checkbox" checked="" />Тёмная тема</label></li>
</ul></li>
<li>Воспроизведение в фидах
<ul class="task-list">
<li><label><input type="checkbox" checked="" />Отключено</label></li>
</ul></li>
<li><label><input type="checkbox" />Картинка в картинке</label></li>
</ul>
<p>
    <div class="meta">
    
      категории <a title="All pages tagged &#39;youtube&#39;." href="/tags/youtube.html" rel="tag">youtube</a>, <a title="All pages tagged &#39;revanced&#39;." href="/tags/revanced.html" rel="tag">revanced</a>
    
    </div>
    <span class="disqus-comment-count" data-disqus-identifier="posts/revanced.md"></span>
</p>
]]></summary>
</entry>
<entry>
    <title>Настройки AdGuard Home</title>
    <link href="https://lukyanovartem.github.io/posts/adguard.html" />
    <id>https://lukyanovartem.github.io/posts/adguard.html</id>
    <published>28.02.2025</published>
    <updated>2025-02-28T00:00:00Z</updated>
    <summary type="html"><![CDATA[<p>
<div class="title"><h1><a href="/posts/adguard.html">Настройки AdGuard Home</a></h1></div>
<div class="meta">28 февраля 2025</div>

</p>
<h1 id="настройки">Настройки</h1>
<h2 id="настройки-dns">Настройки DNS</h2>
<h3 id="upstream-dns-серверы">Upstream DNS-серверы</h3>
<div class="sourceCode" id="cb1"><pre class="sourceCode default"><code class="sourceCode default"><span id="cb1-1"><a href="#cb1-1" aria-hidden="true" tabindex="-1"></a># внешние dns сервера для определённых доменов</span>
<span id="cb1-2"><a href="#cb1-2" aria-hidden="true" tabindex="-1"></a>[/домен1/домен2/]1.2.3.4 5.6.7.8</span>
<span id="cb1-3"><a href="#cb1-3" aria-hidden="true" tabindex="-1"></a># использовать глобальные dns для этих поддоменов</span>
<span id="cb1-4"><a href="#cb1-4" aria-hidden="true" tabindex="-1"></a>[/исключение1.домен1/исключение2.домен2/]#</span>
<span id="cb1-5"><a href="#cb1-5" aria-hidden="true" tabindex="-1"></a># для arr стека</span>
<span id="cb1-6"><a href="#cb1-6" aria-hidden="true" tabindex="-1"></a>[/themoviedb.org/tmdb.org/]4.3.2.1</span></code></pre></div>
<h2 id="настройки-клиентов">Настройки клиентов</h2>
<p>Имя клиента <code>yaos</code><br />
Идентификатор <code>a9:cf:1d:65:79:9a</code></p>
<h1 id="фильтры">Фильтры</h1>
<h2 id="пользовательские-правила-фильтрации">Пользовательские правила фильтрации</h2>
<div class="sourceCode" id="cb2"><pre class="sourceCode default"><code class="sourceCode default"><span id="cb2-1"><a href="#cb2-1" aria-hidden="true" tabindex="-1"></a># правила для yaos</span>
<span id="cb2-2"><a href="#cb2-2" aria-hidden="true" tabindex="-1"></a>||quasar.yandex.net^$client=yaos</span>
<span id="cb2-3"><a href="#cb2-3" aria-hidden="true" tabindex="-1"></a>||rpc.alice.yandex.net^$client=yaos</span>
<span id="cb2-4"><a href="#cb2-4" aria-hidden="true" tabindex="-1"></a>||coslogdydy.in^$client=yaos</span></code></pre></div>
<p>
    <div class="meta">
    
      категории <a title="All pages tagged &#39;dns&#39;." href="/tags/dns.html" rel="tag">dns</a>, <a title="All pages tagged &#39;dhcp&#39;." href="/tags/dhcp.html" rel="tag">dhcp</a>, <a title="All pages tagged &#39;adblock&#39;." href="/tags/adblock.html" rel="tag">adblock</a>
    
    </div>
    <span class="disqus-comment-count" data-disqus-identifier="posts/adguard.md"></span>
</p>
]]></summary>
</entry>
<entry>
    <title>Убираем белый список на WWAN модемы для ThinkPad T480s</title>
    <link href="https://lukyanovartem.github.io/posts/wwan.html" />
    <id>https://lukyanovartem.github.io/posts/wwan.html</id>
    <published>09.04.2024</published>
    <updated>2024-04-09T00:00:00Z</updated>
    <summary type="html"><![CDATA[<p>
<div class="title"><h1><a href="/posts/wwan.html">Убираем белый список на WWAN модемы для ThinkPad T480s</a></h1></div>
<div class="meta"> 9 апреля 2024</div>

</p>
<p><strong>Неактуально, появился порт <a href="https://libreboot.org/docs/install/t480.html">Libreboot</a></strong></p>
<p>Ох уж эта сертификация на модемы, из-за которой можно установить модем только из небольшого списка одобренных. Чтобы убрать ограничение, нужно пропатчить биос. Есть <a href="https://thrimbor.github.io/2019/09/24/removing-the-m2-whitelist-on-a-thinkpad-t440p.html">неплохая статья</a>, однако с ней у меня не вышло. Во-первых бесплатный инструмент Ghidra, рассматриваемый в статье, у меня падает при анализе модуля LenovoWmaPolicyDxe. Пришлось временно воспользоваться пиратской IDA Pro 😳 Кроме того, в статье много воды и лишних телодвижений. В частности, предлагается менять каждый if, делающий проверку на id модема, вместо того, чтобы просто перепрыгнуть подпрограмму, выводящую информационное сообщение и запускающую бесконечный цикл. Да, такой патч получается неуниверсальный, привязанный к конкретной версии, но элементарно создать аналогичный для любой другой версии прошивки.</p>
<p><span class="math inline">

<a href="/gallery/wwan/IMG_20240408_143442.jpg.html"><img src="/gallery/wwan/IMG_20240408_143442.thumb.jpg"/></a>
<link rel="prefetch" href="/gallery/wwan/IMG_20240408_143442.jpg">



<a href="/gallery/wwan/IMG_20240408_143955.jpg.html"><img src="/gallery/wwan/IMG_20240408_143955.thumb.jpg"/></a>
<link rel="prefetch" href="/gallery/wwan/IMG_20240408_143955.jpg">



<a href="/gallery/wwan/IMG_20240408_154057.jpg.html"><img src="/gallery/wwan/IMG_20240408_154057.thumb.jpg"/></a>
<link rel="prefetch" href="/gallery/wwan/IMG_20240408_154057.jpg">



<a href="/gallery/wwan/IMG_20240408_194337.jpg.html"><img src="/gallery/wwan/IMG_20240408_194337.thumb.jpg"/></a>
<link rel="prefetch" href="/gallery/wwan/IMG_20240408_194337.jpg">


</span></p>
<p>
    <div class="meta">
    
      категории <a title="All pages tagged &#39;wwan&#39;." href="/tags/wwan.html" rel="tag">wwan</a>, <a title="All pages tagged &#39;thinkpad&#39;." href="/tags/thinkpad.html" rel="tag">thinkpad</a>
    
    </div>
    <span class="disqus-comment-count" data-disqus-identifier="posts/wwan.md"></span>
</p>
]]></summary>
</entry>
<entry>
    <title>Настройки WWAN модема Sierra EM7455</title>
    <link href="https://lukyanovartem.github.io/posts/em7455.html" />
    <id>https://lukyanovartem.github.io/posts/em7455.html</id>
    <published>09.04.2024</published>
    <updated>2024-04-09T00:00:00Z</updated>
    <summary type="html"><![CDATA[<p>
<div class="title"><h1><a href="/posts/em7455.html">Настройки WWAN модема Sierra EM7455</a></h1></div>
<div class="meta"> 9 апреля 2024</div>

</p>
<p>Прошивание модема</p>
<div class="sourceCode" id="cb1"><pre class="sourceCode default"><code class="sourceCode default"><span id="cb1-1"><a href="#cb1-1" aria-hidden="true" tabindex="-1"></a>AT!ENTERCND=&quot;A710&quot;</span>
<span id="cb1-2"><a href="#cb1-2" aria-hidden="true" tabindex="-1"></a># Clear all changes and restore to (Lenovo/Sierra) factory settings</span>
<span id="cb1-3"><a href="#cb1-3" aria-hidden="true" tabindex="-1"></a>AT!RMARESET=1</span>
<span id="cb1-4"><a href="#cb1-4" aria-hidden="true" tabindex="-1"></a>AT!IMAGE=0</span>
<span id="cb1-5"><a href="#cb1-5" aria-hidden="true" tabindex="-1"></a>AT!RESET</span></code></pre></div>
<div class="sourceCode" id="cb2"><pre class="sourceCode sh"><code class="sourceCode bash"><span id="cb2-1"><a href="#cb2-1" aria-hidden="true" tabindex="-1"></a><span class="ex">qmi-firmware-update</span> <span class="at">--reset</span> <span class="at">-d</span> <span class="st">&quot;1199:9079&quot;</span></span>
<span id="cb2-2"><a href="#cb2-2" aria-hidden="true" tabindex="-1"></a><span class="ex">qmi-firmware-update</span> <span class="at">--update-download</span> <span class="at">-d</span> <span class="st">&quot;1199:9079&quot;</span> SWI9X30C_02.33.03.00.cwe SWI9X30C_02.33.03.00_GENERIC_002.072_001.nvu</span>
<span id="cb2-3"><a href="#cb2-3" aria-hidden="true" tabindex="-1"></a><span class="ex">qmicli</span> <span class="at">-d</span> /dev/cdc-wdm0 <span class="at">--dms-set-firmware-preference</span><span class="op">=</span>02.33.03.00,002.072_001,GENERIC</span></code></pre></div>
<div class="sourceCode" id="cb3"><pre class="sourceCode default"><code class="sourceCode default"><span id="cb3-1"><a href="#cb3-1" aria-hidden="true" tabindex="-1"></a>AT!ENTERCND=&quot;A710&quot;</span>
<span id="cb3-2"><a href="#cb3-2" aria-hidden="true" tabindex="-1"></a>AT!USBVID=1199</span>
<span id="cb3-3"><a href="#cb3-3" aria-hidden="true" tabindex="-1"></a>AT!USBPID=9071,9070</span>
<span id="cb3-4"><a href="#cb3-4" aria-hidden="true" tabindex="-1"></a>AT!USBPRODUCT=&quot;EM7455&quot;</span>
<span id="cb3-5"><a href="#cb3-5" aria-hidden="true" tabindex="-1"></a>AT!PRIID?</span>
<span id="cb3-6"><a href="#cb3-6" aria-hidden="true" tabindex="-1"></a># Carrier PRI: 9999999_9904609_SWI9X30C_02.24.05.06_00_GENERIC_002.026_000</span>
<span id="cb3-7"><a href="#cb3-7" aria-hidden="true" tabindex="-1"></a>AT!PRIID=&quot;9904609&quot;,&quot;002.026&quot;,&quot;Generic-Laptop&quot;</span>
<span id="cb3-8"><a href="#cb3-8" aria-hidden="true" tabindex="-1"></a># Force USB2 mode to enable compatibility with newer M.2 interfaces</span>
<span id="cb3-9"><a href="#cb3-9" aria-hidden="true" tabindex="-1"></a>AT!USBSPEED=0</span>
<span id="cb3-10"><a href="#cb3-10" aria-hidden="true" tabindex="-1"></a>AT!RESET</span></code></pre></div>
<p>Отключение необходимости запуска скрипта по разблокировке модема</p>
<div class="sourceCode" id="cb4"><pre class="sourceCode default"><code class="sourceCode default"><span id="cb4-1"><a href="#cb4-1" aria-hidden="true" tabindex="-1"></a>AT!OPENLOCK?</span>
<span id="cb4-2"><a href="#cb4-2" aria-hidden="true" tabindex="-1"></a>sierrakeygen.py -l &lt;code&gt; -d MDM9x30</span>
<span id="cb4-3"><a href="#cb4-3" aria-hidden="true" tabindex="-1"></a>AT!OPENLOCK=&quot;&lt;newcode&gt;&quot;</span>
<span id="cb4-4"><a href="#cb4-4" aria-hidden="true" tabindex="-1"></a>AT!PCFCCAUTH=0</span>
<span id="cb4-5"><a href="#cb4-5" aria-hidden="true" tabindex="-1"></a>AT!RESET</span></code></pre></div>
<p>
    <div class="meta">
    
      категории <a title="All pages tagged &#39;wwan&#39;." href="/tags/wwan.html" rel="tag">wwan</a>
    
    </div>
    <span class="disqus-comment-count" data-disqus-identifier="posts/em7455.md"></span>
</p>
]]></summary>
</entry>
<entry>
    <title>Глупые IT названия</title>
    <link href="https://lukyanovartem.github.io/posts/tomato.html" />
    <id>https://lukyanovartem.github.io/posts/tomato.html</id>
    <published>11.05.2023</published>
    <updated>2023-05-11T00:00:00Z</updated>
    <summary type="html"><![CDATA[<p>
<div class="title"><h1><a href="/posts/tomato.html">Глупые IT названия</a></h1></div>
<div class="meta">11 мая 2023</div>

</p>
<p>Бриллиантовый монстр и пляжная черепашка поедают галету с помидорами 🥴</p>
<ul>
<li>Материнская плата: ZIDA Tomato Board</li>
<li>Звуковая карта: Turtle Beach</li>
<li>Видеокарта: Diamond Monster 3D</li>
</ul>
<details>
<summary>
Процессор ИСКРА компании Солнечные микросистемы
</summary>
SPARC (Scalable Processor ARChitecture — масштабируемая архитектура процессора) — архитектура RISC-микропроцессоров, первоначально разработанная в 1985 году компанией Sun Microsystems
</details>
<details>
<summary>
FM радио “Города”
</summary>
FM Towns (иногда используются обозначения FM-Towns, FM TOWNS, FM-TOWNS) — японский бытовой компьютер. Создан фирмой Fujitsu, продавался с февраля 1989 по лето 1997 года. Название «FM Towns» произошло от слова «Townes», кодового обозначения системы, которое она имела в процессе разработки. Такое название было выбрано в честь Чарлза Харда Таунса, лауреата Нобелевской премии 1964 года в области физики, следуя используемой в то время фирмой Fujitsu практике кодового обозначения продуктов, относящихся к PC, именами нобелевских лауреатов
</details>
<details>
<summary>
НОВОСТИ от Солнечных ребят
</summary>
The Sony NEWS (“Network Engineering Workstation”, later “NetWorkStation”) is a series of Unix workstations sold during the late 1980s and 1990s
</details>
<details>
<summary>
Профессиональный Ирис “Башни близнецы”
</summary>
The first of these Silicon Graphics systems was the 4D/60 ‘Professional IRIS’, sporting a MIPS R2300 clocked at 8 MHz in a unique ‘twin-tower’ case, with the cardcage being within the larger tower on the left, and the power supply and drives being kept within the smaller tower on the right
</details>
<details>
<summary>
Сетевая карта “Детка”
</summary>
The Sun386i workstation motherboard includes the CPU, 80387 FPU, 82380 timer/DMA/interrupt controller and a custom Ethernet IC called BABE (“Bus Adapter Between Ethernet”)
</details>
<p>
    <div class="meta">
    
      категории <a title="All pages tagged &#39;vintage&#39;." href="/tags/vintage.html" rel="tag">vintage</a>
    
    </div>
    <span class="disqus-comment-count" data-disqus-identifier="posts/tomato.md"></span>
</p>
]]></summary>
</entry>
<entry>
    <title>Домашний сервер</title>
    <link href="https://lukyanovartem.github.io/posts/server.html" />
    <id>https://lukyanovartem.github.io/posts/server.html</id>
    <published>17.09.2021</published>
    <updated>2021-09-17T00:00:00Z</updated>
    <summary type="html"><![CDATA[<p>
<div class="title"><h1><a href="/posts/server.html">Домашний сервер</a></h1></div>
<div class="meta">17 сентября 2021</div>

</p>
<p>Понадобилось собрать домашний сервер для различных гедонистических целей. Как можно заметить на фото ниже, данный сервер и сопутствующие причиндалы уютно разместились на шкафу:</p>
<p><span class="math inline">

<a href="/gallery/server/photo1681667759.jpeg.html"><img src="/gallery/server/photo1681667759.thumb.jpeg"/></a>
<link rel="prefetch" href="/gallery/server/photo1681667759.jpeg">


</span></p>
<p>В качестве компонентов были выбраны следующие железки:</p>
<ul>
<li>Платформа ASRock DeskMini X300</li>
<li>Процессор AMD Ryzen 5 3400G</li>
<li>16 Гб ОЗУ DDR4</li>
<li>256 Гб SSD под систему</li>
<li>2 Тб винт под данные</li>
</ul>
<p>Из сопутствующего:</p>
<ul>
<li>ИБП Ippon Back Power Pro LCD 600</li>
<li>Старый принтер Xerox Phaser 3116</li>
</ul>
<p>Далее, поскольку сервер служит и роутером, понадобилось установить Wi-Fi адаптеры. Для сети стандарта 802.11n выбор пал на дешёвый USB-свисток с Ali на чипе AR9271. Для более современной сети, выбрал QCA6174 формата M.2.
Но просто установить адаптер оказалось недостаточным, пришлось ещё обойти некие региональные ограничения для работы адаптера в режиме токи в диапазоне пятигигагерцовых сетей. К счастью, для драйвера ath10k у проекта OpenWRT оказался патч снимающий данные региональные ограничения.</p>
<p>Небольшой вишенкой на торте стала HDMI-затычка с Ali, эмулирующая присутствие монитора. Что позволяет передавать картинку от графического сервера без использования программных костылей. Пусть лучше будет костыль аппаратный 🙂</p>
<p>Далее перечислены задачи, которые в данный момент решает сервер:</p>
<ul>
<li>Роутер и Wi-Fi точка доступа</li>
<li>Файлопомойка</li>
<li>Торрент-клиент</li>
<li>Медиа-сервер</li>
<li>Стриминг игр на другие устройства</li>
<li>Мониторинг</li>
<li>VPN</li>
<li>Git</li>
<li>Синхронизация файлов</li>
<li>Принт-сервер</li>
</ul>
<p>
    <div class="meta">
    
      категории <a title="All pages tagged &#39;сервер&#39;." href="/tags/%D1%81%D0%B5%D1%80%D0%B2%D0%B5%D1%80.html" rel="tag">сервер</a>, <a title="All pages tagged &#39;linux&#39;." href="/tags/linux.html" rel="tag">linux</a>
    
    </div>
    <span class="disqus-comment-count" data-disqus-identifier="posts/server.md"></span>
</p>
]]></summary>
</entry>
<entry>
    <title>Дачный ретрокомп</title>
    <link href="https://lukyanovartem.github.io/posts/retropc.html" />
    <id>https://lukyanovartem.github.io/posts/retropc.html</id>
    <published>19.07.2021</published>
    <updated>2021-07-19T00:00:00Z</updated>
    <summary type="html"><![CDATA[<p>
<div class="title"><h1><a href="/posts/retropc.html">Дачный ретрокомп</a></h1></div>
<div class="meta">19 июля 2021</div>

</p>
<p>Так получилось, что моим первым компьютером стал системный блок с Pentium II. Это была интересная эпоха - процессор в виде картриджа и щелевой разъём на материнке под него, культовые видеоускорители 3dfx, аудиокарты с таблично-волновым синтезом, материнские платы уже с разъёмом AGP, но всё ещё не избавившиеся от ISA слотов.<br />
Я испытываю сильную ностальгию по тем временам. Однако, я не стал воспроизводить в точности конфигурацию того компьютера, а собрал нечто по его мотивам. Так, под нож пошли форм-фактор AT, разъём клавиатуры DIN5, COM-мышка. Вместо этого была собрана система стандарта ATX, с PS/2 мышью, клавой и USB портами.<br />
Для проверки софта и игр под данную платформу рекомендую эмулятор 86Box, однако для его запуска потребуется достаточно мощный комп.</p>
<p><span class="math inline">

<a href="/gallery/retropc/IMG_20230429_132633.jpg.html"><img src="/gallery/retropc/IMG_20230429_132633.thumb.jpg"/></a>
<link rel="prefetch" href="/gallery/retropc/IMG_20230429_132633.jpg">



<a href="/gallery/retropc/IMG_20230430_090319.jpg.html"><img src="/gallery/retropc/IMG_20230430_090319.thumb.jpg"/></a>
<link rel="prefetch" href="/gallery/retropc/IMG_20230430_090319.jpg">


</span></p>
<p>Итак, что можно собрать:</p>
<ul>
<li>Процессор<br />
Если важна универсальность, то берём Pentium II с разблокированным множителем, что позволит менять частоту процессора. Определить разблокирован ли множитель можно по номеру на картридже. Вторая цифра означает последнюю цифру года, третья и чётвёртая - неделю изготовления. Процессор должен быть изготовлен до 34 недели 98 года<br />
Если нужна максимальная скорость, то можно брать слотовый Pentium III с частотой 500-600 МГц. Процессоры 800 МГц и выше редки и дороги</li>
<li>Материнская плата<br />
Можно приобрести плату стандарта ATX на культовом чипсете 440BX, с набортными USB и PS/2. Желательно с Plug &amp; Play BIOS’ом, чтобы можно было выставлять настройки процессора программно, без джамперов<br />
В случае выбора данного чипсета стоит с вниманием отнестись к подбору процессора, видеокарты и памяти. Так, штатная частота системной шины у данного чипсета - 100 МГц. В случае разгона по шине лучше выбирать видеокарту от Nvidia, т.к. AMD не все переваривают последующее за разгоном повышение частоты AGP. Память плотностью 256 Мб на планку должна быть двухсторонней</li>
<li>Оперативная память<br />
Для девяностовосьмёрки нет необходимости брать больше 512 Мб</li>
<li>Видеокарта<br />
Любая AGP карта с 3.3 В разъёмом, либо универсальная</li>
<li>SATA контроллер<br />
Полезная опция. Дешевые варианты это Silicon Image 3112/3512. TRIM работать не будет, в остальном неплохая вещь</li>
<li>SSD диск<br />
Под 98 винду можно смело брать на 120 Гб, если больше - могут быть проблемы, а меньше теперь, как правило, и не продают</li>
<li>Сетевая карта<br />
Беспроводной адаптер TP-LINK TL-WN651G стандарта 802.11g имеет драйвера под Windows 98, и даже работает</li>
<li>Звуковая карта<br />
Любая для слота ISA, неважно Plug &amp; Play или нет, но лучше чтобы настройки выставлялись программно, а не перемычками. Если хочется приятного звука в DOS играх, то можно взять карту AWE64</li>
<li>USB 2.0 контроллер<br />
Есть смысл поставить для увеличения количества USB слотов и повышения скорости передачи данных, поскольку на материнках той эпохи был лишь медленный USB 1.1. Хорошо будет работать карта на чипе NEC D720100AGM</li>
<li>CD-RW дисковод<br />
Подойдёт старенький пишущий дисковод для шины IDE</li>
</ul>
<p>
    <div class="meta">
    
      категории <a title="All pages tagged &#39;ретрокомпьютер&#39;." href="/tags/%D1%80%D0%B5%D1%82%D1%80%D0%BE%D0%BA%D0%BE%D0%BC%D0%BF%D1%8C%D1%8E%D1%82%D0%B5%D1%80.html" rel="tag">ретрокомпьютер</a>, <a title="All pages tagged &#39;slot1&#39;." href="/tags/slot1.html" rel="tag">slot1</a>
    
    </div>
    <span class="disqus-comment-count" data-disqus-identifier="posts/retropc.md"></span>
</p>
]]></summary>
</entry>
<entry>
    <title>Книги которые взорвали мозг</title>
    <link href="https://lukyanovartem.github.io/posts/books.html" />
    <id>https://lukyanovartem.github.io/posts/books.html</id>
    <published>18.01.2021</published>
    <updated>2021-01-18T00:00:00Z</updated>
    <summary type="html"><![CDATA[<p>
<div class="title"><h1><a href="/posts/books.html">Книги которые взорвали мозг</a></h1></div>
<div class="meta">18 января 2021</div>

</p>
<ul>
<li>Чайна Мьевиль «Вокзал потерянных снов»</li>
<li>Говард Лакврафт «Сомнамбулический поиск неведомого Кадата»</li>
<li>Майкл Суэнвик «Дочь железного дракона»</li>
<li>Дон Делилло «Белый шум»</li>
<li>Джефф Нун «Брошенные машины»</li>
<li>Иван Братко «Программирование на языке Пролог для искусственного интеллекта» <em>(внезапно)</em></li>
<li>Элиезер Юдковский «Гарри Поттер и методы рационального мышления»</li>
<li>Эдвин Э. Эбботт «Флатландия»</li>
</ul>
<p>
    <div class="meta">
    
      категории <a title="All pages tagged &#39;книги&#39;." href="/tags/%D0%BA%D0%BD%D0%B8%D0%B3%D0%B8.html" rel="tag">книги</a>
    
    </div>
    <span class="disqus-comment-count" data-disqus-identifier="posts/books.md"></span>
</p>
]]></summary>
</entry>
<entry>
    <title>Германия</title>
    <link href="https://lukyanovartem.github.io/posts/germany.html" />
    <id>https://lukyanovartem.github.io/posts/germany.html</id>
    <published>16.11.2019</published>
    <updated>2019-11-16T00:00:00Z</updated>
    <summary type="html"><![CDATA[<p>
<div class="title"><h1><a href="/posts/germany.html">Германия</a></h1></div>
<div class="meta">16 ноября 2019</div>

</p>
<p>Съездил в Берлин. Фотоотчет присутствует.</p>
<p><span class="math inline">

<a href="/gallery/germany/IMG_20191109_204239.jpg.html"><img src="/gallery/germany/IMG_20191109_204239.thumb.jpg"/></a>
<link rel="prefetch" href="/gallery/germany/IMG_20191109_204239.jpg">



<a href="/gallery/germany/IMG_20191110_123635.jpg.html"><img src="/gallery/germany/IMG_20191110_123635.thumb.jpg"/></a>
<link rel="prefetch" href="/gallery/germany/IMG_20191110_123635.jpg">



<a href="/gallery/germany/IMG_20191110_164656.jpg.html"><img src="/gallery/germany/IMG_20191110_164656.thumb.jpg"/></a>
<link rel="prefetch" href="/gallery/germany/IMG_20191110_164656.jpg">



<a href="/gallery/germany/IMG_20191110_172042.jpg.html"><img src="/gallery/germany/IMG_20191110_172042.thumb.jpg"/></a>
<link rel="prefetch" href="/gallery/germany/IMG_20191110_172042.jpg">



<a href="/gallery/germany/IMG_20191110_174337.jpg.html"><img src="/gallery/germany/IMG_20191110_174337.thumb.jpg"/></a>
<link rel="prefetch" href="/gallery/germany/IMG_20191110_174337.jpg">


</span></p>
<p>
    <div class="meta">
    
      категории <a title="All pages tagged &#39;путешествия&#39;." href="/tags/%D0%BF%D1%83%D1%82%D0%B5%D1%88%D0%B5%D1%81%D1%82%D0%B2%D0%B8%D1%8F.html" rel="tag">путешествия</a>
    
    </div>
    <span class="disqus-comment-count" data-disqus-identifier="posts/germany.md"></span>
</p>
]]></summary>
</entry>
<entry>
    <title>Хорватия</title>
    <link href="https://lukyanovartem.github.io/posts/croatia.html" />
    <id>https://lukyanovartem.github.io/posts/croatia.html</id>
    <published>22.07.2008</published>
    <updated>2008-07-22T00:00:00Z</updated>
    <summary type="html"><![CDATA[<p>
<div class="title"><h1><a href="/posts/croatia.html">Хорватия</a></h1></div>
<div class="meta">22 июля 2008</div>

</p>
<p><span class="math inline">

<a href="/gallery/croatia/IMG_20210308_0001.jpg.html"><img src="/gallery/croatia/IMG_20210308_0001.thumb.jpg"/></a>
<link rel="prefetch" href="/gallery/croatia/IMG_20210308_0001.jpg">



<a href="/gallery/croatia/IMG_20210308_0002.jpg.html"><img src="/gallery/croatia/IMG_20210308_0002.thumb.jpg"/></a>
<link rel="prefetch" href="/gallery/croatia/IMG_20210308_0002.jpg">



<a href="/gallery/croatia/IMG_20210308_0003.jpg.html"><img src="/gallery/croatia/IMG_20210308_0003.thumb.jpg"/></a>
<link rel="prefetch" href="/gallery/croatia/IMG_20210308_0003.jpg">



<a href="/gallery/croatia/IMG_20210308_0004.jpg.html"><img src="/gallery/croatia/IMG_20210308_0004.thumb.jpg"/></a>
<link rel="prefetch" href="/gallery/croatia/IMG_20210308_0004.jpg">



<a href="/gallery/croatia/IMG_20210308_0005.jpg.html"><img src="/gallery/croatia/IMG_20210308_0005.thumb.jpg"/></a>
<link rel="prefetch" href="/gallery/croatia/IMG_20210308_0005.jpg">


</span></p>
<p>
    <div class="meta">
    
      категории <a title="All pages tagged &#39;путешествия&#39;." href="/tags/%D0%BF%D1%83%D1%82%D0%B5%D1%88%D0%B5%D1%81%D1%82%D0%B2%D0%B8%D1%8F.html" rel="tag">путешествия</a>
    
    </div>
    <span class="disqus-comment-count" data-disqus-identifier="posts/croatia.md"></span>
</p>
]]></summary>
</entry>
<entry>
    <title>Греция</title>
    <link href="https://lukyanovartem.github.io/posts/greece.html" />
    <id>https://lukyanovartem.github.io/posts/greece.html</id>
    <published>01.06.2007</published>
    <updated>2007-06-01T00:00:00Z</updated>
    <summary type="html"><![CDATA[<p>
<div class="title"><h1><a href="/posts/greece.html">Греция</a></h1></div>
<div class="meta"> 1 июня 2007</div>

</p>
<p><span class="math inline">

<a href="/gallery/greece/IMG_20210308_0001.jpg.html"><img src="/gallery/greece/IMG_20210308_0001.thumb.jpg"/></a>
<link rel="prefetch" href="/gallery/greece/IMG_20210308_0001.jpg">



<a href="/gallery/greece/IMG_20210308_0002.jpg.html"><img src="/gallery/greece/IMG_20210308_0002.thumb.jpg"/></a>
<link rel="prefetch" href="/gallery/greece/IMG_20210308_0002.jpg">



<a href="/gallery/greece/IMG_20210308_0003.jpg.html"><img src="/gallery/greece/IMG_20210308_0003.thumb.jpg"/></a>
<link rel="prefetch" href="/gallery/greece/IMG_20210308_0003.jpg">



<a href="/gallery/greece/IMG_20210308_0004.jpg.html"><img src="/gallery/greece/IMG_20210308_0004.thumb.jpg"/></a>
<link rel="prefetch" href="/gallery/greece/IMG_20210308_0004.jpg">


</span></p>
<p>
    <div class="meta">
    
      категории <a title="All pages tagged &#39;путешествия&#39;." href="/tags/%D0%BF%D1%83%D1%82%D0%B5%D1%88%D0%B5%D1%81%D1%82%D0%B2%D0%B8%D1%8F.html" rel="tag">путешествия</a>
    
    </div>
    <span class="disqus-comment-count" data-disqus-identifier="posts/greece.md"></span>
</p>
]]></summary>
</entry>
<entry>
    <title>Карелия</title>
    <link href="https://lukyanovartem.github.io/posts/karelia.html" />
    <id>https://lukyanovartem.github.io/posts/karelia.html</id>
    <published>01.06.2005</published>
    <updated>2005-06-01T00:00:00Z</updated>
    <summary type="html"><![CDATA[<p>
<div class="title"><h1><a href="/posts/karelia.html">Карелия</a></h1></div>
<div class="meta"> 1 июня 2005</div>

</p>
<p><span class="math inline">

<a href="/gallery/karelia/IMG_20210308_0001.jpg.html"><img src="/gallery/karelia/IMG_20210308_0001.thumb.jpg"/></a>
<link rel="prefetch" href="/gallery/karelia/IMG_20210308_0001.jpg">



<a href="/gallery/karelia/IMG_20210308_0002.jpg.html"><img src="/gallery/karelia/IMG_20210308_0002.thumb.jpg"/></a>
<link rel="prefetch" href="/gallery/karelia/IMG_20210308_0002.jpg">



<a href="/gallery/karelia/IMG_20210308_0003.jpg.html"><img src="/gallery/karelia/IMG_20210308_0003.thumb.jpg"/></a>
<link rel="prefetch" href="/gallery/karelia/IMG_20210308_0003.jpg">



<a href="/gallery/karelia/IMG_20210308_0004.jpg.html"><img src="/gallery/karelia/IMG_20210308_0004.thumb.jpg"/></a>
<link rel="prefetch" href="/gallery/karelia/IMG_20210308_0004.jpg">



<a href="/gallery/karelia/IMG_20210308_0005.jpg.html"><img src="/gallery/karelia/IMG_20210308_0005.thumb.jpg"/></a>
<link rel="prefetch" href="/gallery/karelia/IMG_20210308_0005.jpg">



<a href="/gallery/karelia/IMG_20210308_0006.jpg.html"><img src="/gallery/karelia/IMG_20210308_0006.thumb.jpg"/></a>
<link rel="prefetch" href="/gallery/karelia/IMG_20210308_0006.jpg">



<a href="/gallery/karelia/IMG_20210308_0007.jpg.html"><img src="/gallery/karelia/IMG_20210308_0007.thumb.jpg"/></a>
<link rel="prefetch" href="/gallery/karelia/IMG_20210308_0007.jpg">



<a href="/gallery/karelia/IMG_20210308_0008.jpg.html"><img src="/gallery/karelia/IMG_20210308_0008.thumb.jpg"/></a>
<link rel="prefetch" href="/gallery/karelia/IMG_20210308_0008.jpg">


</span></p>
<p>
    <div class="meta">
    
      категории <a title="All pages tagged &#39;путешествия&#39;." href="/tags/%D0%BF%D1%83%D1%82%D0%B5%D1%88%D0%B5%D1%81%D1%82%D0%B2%D0%B8%D1%8F.html" rel="tag">путешествия</a>
    
    </div>
    <span class="disqus-comment-count" data-disqus-identifier="posts/karelia.md"></span>
</p>
]]></summary>
</entry>
<entry>
    <title>Англия</title>
    <link href="https://lukyanovartem.github.io/posts/england.html" />
    <id>https://lukyanovartem.github.io/posts/england.html</id>
    <published>01.06.2003</published>
    <updated>2003-06-01T00:00:00Z</updated>
    <summary type="html"><![CDATA[<p>
<div class="title"><h1><a href="/posts/england.html">Англия</a></h1></div>
<div class="meta"> 1 июня 2003</div>

</p>
<p><span class="math inline">

<a href="/gallery/england/IMG_20210308_0001.jpg.html"><img src="/gallery/england/IMG_20210308_0001.thumb.jpg"/></a>
<link rel="prefetch" href="/gallery/england/IMG_20210308_0001.jpg">



<a href="/gallery/england/IMG_20210308_0002.jpg.html"><img src="/gallery/england/IMG_20210308_0002.thumb.jpg"/></a>
<link rel="prefetch" href="/gallery/england/IMG_20210308_0002.jpg">



<a href="/gallery/england/IMG_20210308_0003.jpg.html"><img src="/gallery/england/IMG_20210308_0003.thumb.jpg"/></a>
<link rel="prefetch" href="/gallery/england/IMG_20210308_0003.jpg">



<a href="/gallery/england/IMG_20210308_0004.jpg.html"><img src="/gallery/england/IMG_20210308_0004.thumb.jpg"/></a>
<link rel="prefetch" href="/gallery/england/IMG_20210308_0004.jpg">



<a href="/gallery/england/IMG_20210308_0005.jpg.html"><img src="/gallery/england/IMG_20210308_0005.thumb.jpg"/></a>
<link rel="prefetch" href="/gallery/england/IMG_20210308_0005.jpg">


</span></p>
<p>
    <div class="meta">
    
      категории <a title="All pages tagged &#39;путешествия&#39;." href="/tags/%D0%BF%D1%83%D1%82%D0%B5%D1%88%D0%B5%D1%81%D1%82%D0%B2%D0%B8%D1%8F.html" rel="tag">путешествия</a>
    
    </div>
    <span class="disqus-comment-count" data-disqus-identifier="posts/england.md"></span>
</p>
]]></summary>
</entry>
<entry>
    <title>Латвия</title>
    <link href="https://lukyanovartem.github.io/posts/latvia.html" />
    <id>https://lukyanovartem.github.io/posts/latvia.html</id>
    <published>01.06.2001</published>
    <updated>2001-06-01T00:00:00Z</updated>
    <summary type="html"><![CDATA[<p>
<div class="title"><h1><a href="/posts/latvia.html">Латвия</a></h1></div>
<div class="meta"> 1 июня 2001</div>

</p>
<p><span class="math inline">

<a href="/gallery/latvia/IMG_20210308_0001.jpg.html"><img src="/gallery/latvia/IMG_20210308_0001.thumb.jpg"/></a>
<link rel="prefetch" href="/gallery/latvia/IMG_20210308_0001.jpg">



<a href="/gallery/latvia/IMG_20210308_0002.jpg.html"><img src="/gallery/latvia/IMG_20210308_0002.thumb.jpg"/></a>
<link rel="prefetch" href="/gallery/latvia/IMG_20210308_0002.jpg">



<a href="/gallery/latvia/IMG_20210308_0003.jpg.html"><img src="/gallery/latvia/IMG_20210308_0003.thumb.jpg"/></a>
<link rel="prefetch" href="/gallery/latvia/IMG_20210308_0003.jpg">



<a href="/gallery/latvia/IMG_20210308_0004.jpg.html"><img src="/gallery/latvia/IMG_20210308_0004.thumb.jpg"/></a>
<link rel="prefetch" href="/gallery/latvia/IMG_20210308_0004.jpg">



<a href="/gallery/latvia/IMG_20210308_0005.jpg.html"><img src="/gallery/latvia/IMG_20210308_0005.thumb.jpg"/></a>
<link rel="prefetch" href="/gallery/latvia/IMG_20210308_0005.jpg">


</span></p>
<p>
    <div class="meta">
    
      категории <a title="All pages tagged &#39;путешествия&#39;." href="/tags/%D0%BF%D1%83%D1%82%D0%B5%D1%88%D0%B5%D1%81%D1%82%D0%B2%D0%B8%D1%8F.html" rel="tag">путешествия</a>
    
    </div>
    <span class="disqus-comment-count" data-disqus-identifier="posts/latvia.md"></span>
</p>
]]></summary>
</entry>

</feed>
